{
  "schemaVersion": "1.0.0",
  "catalogVersion": "2026.08.10-001-git",
  "createdAt": "2026-08-10T00:00:00Z",
  "expiresAt": "2099-12-31T23:59:59Z",
  "keyID": "0000000000000000",
  "signature": "",
  "tools": [
    {
      "id": "git",
      "slug": "git",
      "name": "Git",
      "localizedName": {
        "en": "Git",
        "zh-Hans": "Git"
      },
      "description": "Distributed version control system designed to handle everything from small to very large projects with speed and efficiency.",
      "localizedDescription": {
        "en": "Distributed version control system designed to handle everything from small to very large projects with speed and efficiency.",
        "zh-Hans": "分布式版本控制系统，速度快且可扩展，能够高效处理从小型到超大型项目。"
      },
      "category": "git-collaboration",
      "tags": ["vcs", "git", "cli", "scm"],
      "homepageURL": "https://git-scm.com",
      "documentationURL": "https://git-scm.com/doc",
      "installOptions": [
        {
          "type": "homebrew-formula",
          "packageName": "git",
          "versionRule": ">=2.46.0",
          "riskLevel": "low"
        }
      ],
      "launchCapability": {
        "type": "cli",
        "command": "git",
        "arguments": ["--version"],
        "openInTerminal": true
      },
      "supportedArchitectures": ["arm64", "x86_64"],
      "minimumMacOS": "14.0",
      "status": "active",
      "riskLevel": "low"
    }
  ],
  "revokedItems": []
}
