{
  "catalogVersion" : "2026.08.11-001-neovim",
  "createdAt" : "2026-08-11T00:00:00Z",
  "expiresAt" : "2099-12-31T23:59:59Z",
  "keyID" : "52d8fe708b101393",
  "revokedItems" : [

  ],
  "schemaVersion" : "1.0.0",
  "signature" : "8k88+aCtSW83cLdxnff/k64NQJExSITTXiL0LvjmKP7b1KnJrxA7/O71atR8MiuvOK56r02fRXy8Mzi6c/DGBg==",
  "tools" : [
    {
      "category" : "editor",
      "description" : "Hyperextensible Vim-based text editor. Built for Lua scripting, modern UIs, and better defaults than stock Vim.",
      "documentationURL" : "https://neovim.io/doc/user/",
      "homepageURL" : "https://neovim.io",
      "id" : "neovim",
      "installOptions" : [
        {
          "packageName" : "neovim",
          "riskLevel" : "low",
          "type" : "homebrew-formula",
          "versionRule" : ">=0.10.0"
        }
      ],
      "launchCapability" : {
        "arguments" : [
          "--version"
        ],
        "command" : "nvim",
        "openInTerminal" : true,
        "type" : "cli"
      },
      "localizedDescription" : {
        "en" : "Hyperextensible Vim-based text editor. Built for Lua scripting, modern UIs, and better defaults than stock Vim.",
        "zh-Hans" : "超可扩展的 Vim 分支编辑器。为 Lua 脚本、现代 UI、优于 Vim 的默认配置而设计。"
      },
      "localizedName" : {
        "en" : "Neovim",
        "zh-Hans" : "Neovim"
      },
      "minimumMacOS" : "14.0",
      "name" : "Neovim",
      "riskLevel" : "low",
      "slug" : "nvim",
      "status" : "active",
      "supportedArchitectures" : [
        "arm64",
        "x86_64"
      ],
      "tags" : [
        "neovim",
        "nvim",
        "editor",
        "lua",
        "cli"
      ]
    }
  ]
}