{
  "schemaVersion": "1.0.0",
  "catalogVersion": "2026.08.11-001-fzf",
  "createdAt": "2026-08-11T00:00:00Z",
  "expiresAt": "2099-12-31T23:59:59Z",
  "keyID": "0000000000000000",
  "signature": "",
  "tools": [
    {
      "id": "fzf",
      "slug": "fzf",
      "name": "fzf",
      "localizedName": {
        "en": "fzf",
        "zh-Hans": "fzf"
      },
      "description": "Command-line fuzzy finder. Pipe any list into fzf and select items with an interactive filter.",
      "localizedDescription": {
        "en": "Command-line fuzzy finder. Pipe any list into fzf and select items with an interactive filter.",
        "zh-Hans": "命令行模糊查找工具。把任意列表管道到 fzf，交互式过滤选择。"
      },
      "category": "cli-utility",
      "tags": ["fzf", "search", "fuzzy", "cli"],
      "homepageURL": "https://github.com/junegunn/fzf",
      "documentationURL": "https://github.com/junegunn/fzf#usage",
      "installOptions": [
        {
          "type": "homebrew-formula",
          "packageName": "fzf",
          "versionRule": ">=0.55.0",
          "riskLevel": "low"
        }
      ],
      "launchCapability": {
        "type": "cli",
        "command": "fzf",
        "arguments": ["--version"],
        "openInTerminal": true
      },
      "supportedArchitectures": ["arm64", "x86_64"],
      "minimumMacOS": "14.0",
      "status": "active",
      "riskLevel": "low"
    }
  ],
  "revokedItems": []
}
