{
  "catalogVersion" : "2026.08.11-001-postman",
  "createdAt" : "2026-08-11T00:00:00Z",
  "expiresAt" : "2099-12-31T23:59:59Z",
  "keyID" : "52d8fe708b101393",
  "revokedItems" : [

  ],
  "schemaVersion" : "1.0.0",
  "signature" : "AKbYKY35tWGl0nJ2xOd5884DMdDeSz0Cdw2coV+PzViuzr1OxnGHOovCSdqOAp56h4M4lpafRQnd4elcl0KIAg==",
  "tools" : [
    {
      "category" : "api-debug",
      "description" : "API client for designing, building, testing, and collaborating on APIs. Graphical alternative to curl.",
      "documentationURL" : "https://learning.postman.com",
      "homepageURL" : "https://www.postman.com",
      "id" : "postman",
      "installOptions" : [
        {
          "packageName" : "postman",
          "riskLevel" : "medium",
          "type" : "homebrew-cask"
        }
      ],
      "launchCapability" : {
        "bundleID" : "com.postmanlabs.mac",
        "type" : "app"
      },
      "localizedDescription" : {
        "en" : "API client for designing, building, testing, and collaborating on APIs. Graphical alternative to curl.",
        "zh-Hans" : "API 客户端，用于设计、构建、测试与协作。curl 的图形替代品。"
      },
      "localizedName" : {
        "en" : "Postman",
        "zh-Hans" : "Postman"
      },
      "minimumMacOS" : "14.0",
      "name" : "Postman",
      "riskLevel" : "medium",
      "slug" : "postman",
      "status" : "active",
      "supportedArchitectures" : [
        "arm64",
        "x86_64"
      ],
      "tags" : [
        "postman",
        "api",
        "http",
        "rest"
      ]
    }
  ]
}