{
  "catalogVersion" : "2026.08.10-001-nodejs",
  "createdAt" : "2026-08-10T00:00:00Z",
  "expiresAt" : "2099-12-31T23:59:59Z",
  "keyID" : "52d8fe708b101393",
  "revokedItems" : [

  ],
  "schemaVersion" : "1.0.0",
  "signature" : "ducNcG/kqxxSYwEm6RBkGaB8fI4WZ7HrFyJ0KKrEsEJXMM25tnBhgUVwBN7X7LxJYo/qWSg/mjphlQ0kzWBvAA==",
  "tools" : [
    {
      "category" : "language-runtime",
      "description" : "JavaScript runtime built on Chrome's V8 engine. Designed for building scalable network applications.",
      "documentationURL" : "https://nodejs.org/en/docs",
      "homepageURL" : "https://nodejs.org",
      "id" : "nodejs",
      "installOptions" : [
        {
          "riskLevel" : "low",
          "toolName" : "node",
          "type" : "mise-tool",
          "version" : "22"
        },
        {
          "packageName" : "node",
          "riskLevel" : "low",
          "type" : "homebrew-formula",
          "versionRule" : ">=22.0.0"
        }
      ],
      "launchCapability" : {
        "arguments" : [
          "--version"
        ],
        "command" : "node",
        "openInTerminal" : true,
        "type" : "cli"
      },
      "localizedDescription" : {
        "en" : "JavaScript runtime built on Chrome's V8 engine. Designed for building scalable network applications.",
        "zh-Hans" : "基于 Chrome V8 引擎的 JavaScript 运行时，用于构建可扩展的网络应用。"
      },
      "localizedName" : {
        "en" : "Node.js",
        "zh-Hans" : "Node.js"
      },
      "minimumMacOS" : "14.0",
      "name" : "Node.js",
      "riskLevel" : "low",
      "slug" : "nodejs",
      "status" : "active",
      "supportedArchitectures" : [
        "arm64",
        "x86_64"
      ],
      "tags" : [
        "javascript",
        "node",
        "runtime",
        "npm"
      ]
    }
  ]
}