{
  "catalogVersion" : "2026.08.11-001-tmux",
  "createdAt" : "2026-08-11T00:00:00Z",
  "expiresAt" : "2099-12-31T23:59:59Z",
  "keyID" : "52d8fe708b101393",
  "revokedItems" : [

  ],
  "schemaVersion" : "1.0.0",
  "signature" : "QI861uql7Jtz4+BUnBPTYrHBdyE8KY23en2rocgI03iBSt+UaZEjaIm9CuYfvJSdB7OpruzD4Pc+pip8AFAyBQ==",
  "tools" : [
    {
      "category" : "terminal",
      "description" : "Terminal multiplexer. Run multiple terminal sessions inside a single window, detach and reattach, share sessions.",
      "documentationURL" : "https://github.com/tmux/tmux/wiki",
      "homepageURL" : "https://github.com/tmux/tmux",
      "id" : "tmux",
      "installOptions" : [
        {
          "packageName" : "tmux",
          "riskLevel" : "low",
          "type" : "homebrew-formula",
          "versionRule" : ">=3.4.0"
        }
      ],
      "launchCapability" : {
        "arguments" : [
          "-V"
        ],
        "command" : "tmux",
        "openInTerminal" : true,
        "type" : "cli"
      },
      "localizedDescription" : {
        "en" : "Terminal multiplexer. Run multiple terminal sessions inside a single window, detach and reattach, share sessions.",
        "zh-Hans" : "终端复用器。在一个窗口里跑多个终端会话，可分离后重连，可共享会话。"
      },
      "localizedName" : {
        "en" : "tmux",
        "zh-Hans" : "tmux"
      },
      "minimumMacOS" : "14.0",
      "name" : "tmux",
      "riskLevel" : "low",
      "slug" : "tmux",
      "status" : "active",
      "supportedArchitectures" : [
        "arm64",
        "x86_64"
      ],
      "tags" : [
        "tmux",
        "terminal",
        "multiplexer",
        "cli"
      ]
    }
  ]
}