{
  "schemaVersion": "1.0.0",
  "catalogVersion": "2026.08.11-001-docker",
  "createdAt": "2026-08-11T00:00:00Z",
  "expiresAt": "2099-12-31T23:59:59Z",
  "keyID": "0000000000000000",
  "signature": "",
  "tools": [
    {
      "id": "docker-desktop",
      "slug": "docker",
      "name": "Docker Desktop",
      "localizedName": {
        "en": "Docker Desktop",
        "zh-Hans": "Docker Desktop"
      },
      "description": "Official Docker Desktop for Mac. Build, share, and run containerized applications with Docker Engine, Kubernetes, and developer tools.",
      "localizedDescription": {
        "en": "Official Docker Desktop for Mac. Build, share, and run containerized applications with Docker Engine, Kubernetes, and developer tools.",
        "zh-Hans": "官方 Docker Desktop for Mac。构建、分享、运行容器化应用，含 Docker 引擎、Kubernetes 与开发工具。"
      },
      "category": "docker",
      "tags": ["docker", "containers", "kubernetes", "devops"],
      "homepageURL": "https://www.docker.com/products/docker-desktop",
      "documentationURL": "https://docs.docker.com/desktop/",
      "installOptions": [
        {
          "type": "homebrew-cask",
          "packageName": "docker",
          "riskLevel": "medium"
        }
      ],
      "launchCapability": {
        "type": "app",
        "bundleID": "com.docker.docker"
      },
      "supportedArchitectures": ["arm64", "x86_64"],
      "minimumMacOS": "14.0",
      "status": "active",
      "riskLevel": "medium"
    }
  ],
  "revokedItems": []
}
